{"snapshot_state":"closed","ontology_environment":[{"package":"@simulation-ontology/core-reference-fixture","version":"0.1.0"},{"package":"@simulation-ontology/thermal-reference","version":"0.1.0"}],"entities":[{"id":"model:thermal-simulation","type":"https://simulation-ontology.org/id/ixldsvm7j7","properties":[]},{"id":"model:thermal-model","type":"https://simulation-ontology.org/id/n6hnqkv3di","properties":[]},{"id":"model:steady-thermal-task","type":"https://simulation-ontology.org/id/ek2roynkft","properties":[]},{"id":"model:thermal-physics","type":"https://simulation-ontology.org/id/ea6sl5xtmn","properties":[]},{"id":"model:heat-math-model","type":"https://simulation-ontology.org/id/zly2cgjhi6","properties":[]},{"id":"model:fourier-law","type":"https://simulation-ontology.org/id/ntrfu3aazy","properties":[]},{"id":"model:thermal-spatial-model","type":"https://simulation-ontology.org/id/or6fspgbux","properties":[]},{"id":"model:thermal-material-model","type":"https://simulation-ontology.org/id/nnuja64xb4","properties":[]},{"id":"model:thermal-condition-model","type":"https://simulation-ontology.org/id/celao4rg3k","properties":[]},{"id":"model:temperature-field","type":"https://simulation-ontology.org/id/tbevelcebb","properties":[]},{"id":"model:thermal-conductivity","type":"https://simulation-ontology.org/id/q47ddhjosq","properties":[{"property":"https://simulation-ontology.org/id/lyw3ihoott","value_definition":{"mechanism":"literal","value":{"shape":"scalar","scalar_kind":"number","data":{"coefficient":"1","exponent10":1},"unit":{"namespace":"si-ref","id":"W_per_m_K"}}}}]},{"id":"model:solid-domain-scope","type":"https://simulation-ontology.org/id/2rnfz3s7gq","properties":[]},{"id":"model:left-boundary-scope","type":"https://simulation-ontology.org/id/2rnfz3s7gq","properties":[]},{"id":"model:right-boundary-scope","type":"https://simulation-ontology.org/id/2rnfz3s7gq","properties":[]},{"id":"model:left-fixed-temperature","type":"https://simulation-ontology.org/id/dxjj2gbpiu","properties":[{"property":"https://simulation-ontology.org/id/wsoh3uq6on","value_definition":{"mechanism":"literal","value":{"shape":"scalar","scalar_kind":"number","data":{"coefficient":"3","exponent10":2},"unit":{"namespace":"si-ref","id":"K"}}}}]},{"id":"model:right-fixed-temperature","type":"https://simulation-ontology.org/id/dxjj2gbpiu","properties":[{"property":"https://simulation-ontology.org/id/wsoh3uq6on","value_definition":{"mechanism":"literal","value":{"shape":"scalar","scalar_kind":"number","data":{"coefficient":"4","exponent10":2},"unit":{"namespace":"si-ref","id":"K"}}}}]},{"id":"model:stationary-thermal-analysis","type":"https://simulation-ontology.org/id/6sxlm7tyu2","properties":[]}],"relations":[{"relation":"https://simulation-ontology.org/id/lpihscphvu","source":"model:thermal-simulation","target":"model:thermal-model"},{"relation":"https://simulation-ontology.org/id/y4vqvgd65p","source":"model:thermal-simulation","target":"model:steady-thermal-task"},{"relation":"https://simulation-ontology.org/id/jufj3lqm53","source":"model:steady-thermal-task","target":"model:thermal-model"},{"relation":"https://simulation-ontology.org/id/vwahw7exkr","source":"model:steady-thermal-task","target":"model:stationary-thermal-analysis"},{"relation":"https://simulation-ontology.org/id/kio7kpq2bu","source":"model:thermal-model","target":"model:thermal-physics"},{"relation":"https://simulation-ontology.org/id/kio7kpq2bu","source":"model:thermal-model","target":"model:heat-math-model"},{"relation":"https://simulation-ontology.org/id/kio7kpq2bu","source":"model:thermal-model","target":"model:fourier-law"},{"relation":"https://simulation-ontology.org/id/kio7kpq2bu","source":"model:thermal-model","target":"model:thermal-spatial-model"},{"relation":"https://simulation-ontology.org/id/kio7kpq2bu","source":"model:thermal-model","target":"model:thermal-material-model"},{"relation":"https://simulation-ontology.org/id/kio7kpq2bu","source":"model:thermal-model","target":"model:thermal-condition-model"},{"relation":"https://simulation-ontology.org/id/nd57r64qcm","source":"model:thermal-physics","target":"model:heat-math-model"},{"relation":"https://simulation-ontology.org/id/vjoujc643w","source":"model:heat-math-model","target":"model:fourier-law"},{"relation":"https://simulation-ontology.org/id/meje7xbs5s","source":"model:heat-math-model","target":"model:thermal-spatial-model"},{"relation":"https://simulation-ontology.org/id/kio7kpq2bu","source":"model:heat-math-model","target":"model:temperature-field"},{"relation":"https://simulation-ontology.org/id/ic6qdnsfqj","source":"model:fourier-law","target":"model:thermal-material-model"},{"relation":"https://simulation-ontology.org/id/kio7kpq2bu","source":"model:thermal-material-model","target":"model:thermal-conductivity"},{"relation":"https://simulation-ontology.org/id/kio7kpq2bu","source":"model:thermal-spatial-model","target":"model:solid-domain-scope"},{"relation":"https://simulation-ontology.org/id/kio7kpq2bu","source":"model:thermal-spatial-model","target":"model:left-boundary-scope"},{"relation":"https://simulation-ontology.org/id/kio7kpq2bu","source":"model:thermal-spatial-model","target":"model:right-boundary-scope"},{"relation":"https://simulation-ontology.org/id/kio7kpq2bu","source":"model:thermal-condition-model","target":"model:left-fixed-temperature"},{"relation":"https://simulation-ontology.org/id/kio7kpq2bu","source":"model:thermal-condition-model","target":"model:right-fixed-temperature"},{"relation":"https://simulation-ontology.org/id/msrwiztb4t","source":"model:left-fixed-temperature","target":"model:temperature-field"},{"relation":"https://simulation-ontology.org/id/msrwiztb4t","source":"model:left-fixed-temperature","target":"model:left-boundary-scope"},{"relation":"https://simulation-ontology.org/id/msrwiztb4t","source":"model:right-fixed-temperature","target":"model:temperature-field"},{"relation":"https://simulation-ontology.org/id/msrwiztb4t","source":"model:right-fixed-temperature","target":"model:right-boundary-scope"}]}