{"snapshot_state":"closed","ontology_environment":[{"package":"@simulation-ontology/core-reference-fixture","version":"0.1.0"},{"package":"@simulation-ontology/plasma-reference","version":"0.1.0"}],"entities":[{"id":"model:plasma-simulation","type":"https://simulation-ontology.org/id/ixldsvm7j7","properties":[]},{"id":"model:plasma-model","type":"https://simulation-ontology.org/id/n6hnqkv3di","properties":[]},{"id":"model:plasma-task","type":"https://simulation-ontology.org/id/ek2roynkft","properties":[]},{"id":"model:plasma-physics","type":"https://simulation-ontology.org/id/eq6dhpk4dm","properties":[]},{"id":"model:plasma-material-model","type":"https://simulation-ontology.org/id/nnuja64xb4","properties":[]},{"id":"model:attachment-reaction","type":"https://simulation-ontology.org/id/4xhmdsg7j3","properties":[]},{"id":"model:electron","type":"https://simulation-ontology.org/id/3arobejact","properties":[]},{"id":"model:cl2","type":"https://simulation-ontology.org/id/j3ijlmlobp","properties":[]},{"id":"model:cl-minus","type":"https://simulation-ontology.org/id/yyoyushsmg","properties":[]},{"id":"model:cl-atom","type":"https://simulation-ontology.org/id/pdqv5bjaq4","properties":[]},{"id":"model:stationary-plasma-analysis","type":"https://simulation-ontology.org/id/6sxlm7tyu2","properties":[]}],"relations":[{"relation":"https://simulation-ontology.org/id/lpihscphvu","source":"model:plasma-simulation","target":"model:plasma-model"},{"relation":"https://simulation-ontology.org/id/y4vqvgd65p","source":"model:plasma-simulation","target":"model:plasma-task"},{"relation":"https://simulation-ontology.org/id/jufj3lqm53","source":"model:plasma-task","target":"model:plasma-model"},{"relation":"https://simulation-ontology.org/id/vwahw7exkr","source":"model:plasma-task","target":"model:stationary-plasma-analysis"},{"relation":"https://simulation-ontology.org/id/kio7kpq2bu","source":"model:plasma-model","target":"model:plasma-physics"},{"relation":"https://simulation-ontology.org/id/kio7kpq2bu","source":"model:plasma-model","target":"model:plasma-material-model"},{"relation":"https://simulation-ontology.org/id/kio7kpq2bu","source":"model:plasma-physics","target":"model:attachment-reaction"},{"relation":"https://simulation-ontology.org/id/kio7kpq2bu","source":"model:plasma-material-model","target":"model:electron"},{"relation":"https://simulation-ontology.org/id/kio7kpq2bu","source":"model:plasma-material-model","target":"model:cl2"},{"relation":"https://simulation-ontology.org/id/kio7kpq2bu","source":"model:plasma-material-model","target":"model:cl-minus"},{"relation":"https://simulation-ontology.org/id/kio7kpq2bu","source":"model:plasma-material-model","target":"model:cl-atom"},{"relation":"https://simulation-ontology.org/id/is3q43nx2u","source":"model:attachment-reaction","target":"model:electron"},{"relation":"https://simulation-ontology.org/id/is3q43nx2u","source":"model:attachment-reaction","target":"model:cl2"},{"relation":"https://simulation-ontology.org/id/o7hkersiye","source":"model:attachment-reaction","target":"model:cl-minus"},{"relation":"https://simulation-ontology.org/id/o7hkersiye","source":"model:attachment-reaction","target":"model:cl-atom"}]}